Organization Name,Category,Description,GSoC Page,Interested,Notes
Wellcome Sanger Tree of Life,,Genome analysis for all species,https://summerofcode.withgoogle.com/programs/2025/organizations/wellcome-sanger-institute,No,
Zulip,,Organized chat for distributed teams,https://summerofcode.withgoogle.com/programs/2025/organizations/zulip,No,
Zendalona,,FOSS accessibility solutions for visually impaired,https://summerofcode.withgoogle.com/programs/2025/organizations/zendalona,No,
Waycrate,,Writing robust tools for the Wayland protocol,https://summerofcode.withgoogle.com/programs/2025/organizations/waycrate,No,
webpack,,webpack is the module bundler for web projects,https://summerofcode.withgoogle.com/programs/2025/organizations/webpack,No,